{
  "scenario_id": "road56-stress-test",
  "title": "国道56号区間停止チェック",
  "description": "国道56号の選択区間を完全停止した場合のネットワークStress Test。公式被害予測ではない。",
  "classification": "D",
  "network_version": "osm-ehime-major-roads-snapshot",
  "gtfs_version": null,
  "od_model_version": "not_available_pending_census_od",
  "disabled_links": ["osm-way-68245228"],
  "capacity_reductions": {},
  "parameters": {
    "closure": "complete",
    "population_reference": "R6 500m mesh aggregated to 0.1 degree public zones",
    "destination": "population-weighted network node"
  },
  "result_version": "road-accessibility-v0.1.0",
  "created_at": "2026-08-22T00:00:00+09:00"
}
